### DISCUSSION TITLE
Cluster down: OSD heartbeat checks failing post power outage after upgrading to v1.14.8 (and Reef)

### DISCUSSION THREAD

**Discussion by psarossy** [rook/rook#14474] [Q&A]
Hi folks,

I’m completely stumped aftery digging for 4 days now and would any ideas help to restore my cluster :(

Starting with a healthy cluster I’ve upgraded to v1.14.8 and ceph/ceph:v18.2.2-20240311 on last Saturday.
Everything looked fine, and the cluster was serving as normal. Overnight there were some thunderstorms, and due to some UPS troubles all of the storage nodes rebooted.

Since then PGs cannot activate as the OSDs are stuck peering but seemingly can no longer talk to each other, every OSD has heartbeat_check failures: https://pastebin.com/3YvAhMNK

All of the PGs and OSDs are cycling between down and peering, PG not active fluctuates between 92% and 97%+: https://pastebin.com/cnPS99j4

I use Calico as the CNI (via the tigera operator) but the ceph cluster is in hostnetwork mode.

Can’t see any other errors in node logs or CNI logs.

I can also curl the addresses that show up in the OSD logs:

OSD.91 to OSD.43
```
[root@glaucus ceph]# curl 10.0.0.13:6830 2> /dev/null
ceph v2

[root@glaucus ceph]# ping 10.0.0.13
PING 10.0.0.13 (10.0.0.13) 56(84) bytes of data.
64 bytes from 10.0.0.13: icmp_seq=1 ttl=64 time=0.307 ms
```

It feels like a CNI issue as always, or Ubuntu developing yet another fatal change, but can’t seem to find anything.

Cluster definition https://pastebin.com/fdc8XDmk
**Environment**:
* OS (e.g. from /etc/os-release):  Ubuntu 20.04.6 LTS
* Kernel (e.g. `uname -a`): 5.15.0-113-generic
* Cloud provider or hardware configuration: Bare metal, 11 node cluster (8 running OSDs)
* Rook version (use `rook version` inside of a Rook Pod):  v1.6.11
* Storage backend version (e.g. for ceph do `ceph -v`): 18.2.2
* Kubernetes version (use `kubectl version`): v1.27.4
* Kubernetes cluster type (e.g. Tectonic, GKE, OpenShift): kubeadm

**Comment by microyahoo** [comment]
Your cluster has 8 OSDs down, you can check the OSD logs or describe the pod to see why the OSDs are not coming up. The cluster can recover after the OSDs come back up.

**Reply by psarossy** [reply]
The OSDs keep cycling offline and back online, it goes between no OSDs down to 20+ down, but the PGs never go from peering back to active.

All the OSD logs just repeat `heartbeat_check: no reply from 10.0.0.100:6814 osd.71 ever on either front or back, first ping sent 2024-07-22T20:34:42.514888+0000 (oldest deadline...` from their various peer IPs depending on the osd.#

**Comment by psarossy** [comment]
What's even more bizarre, it seems like the OSDs can talk to the MONs but not to each other...

**Comment by psarossy** [comment]
Keep digging, if I disable the cluster network interface, it correctly complains that no IPs are avilable.
Re-enabled them, the osd is listening on both interfaces as expected yet unreachable.
<img width="547" alt="Screenshot 2024-07-22 at 18 44 13" src="https://github.com/user-attachments/assets/82d02634-cdf0-43e0-a505-bd8ddbb97d7b">

**Comment by psarossy** [comment]
The OSDs keep marking each other dead, then telling the MON that they are not dead and cancelling the request:

```
mon cluster 2024-07-22T22:55:36.964366+0000 osd.11 (osd.11) 1716 : cluster 3 1 slow requests (by type [ 'delayed' : 1 ] most affected pool [ 'mediaroot-rep3-new' : 1 ])
mon cluster 2024-07-22T22:55:37.163514+0000 mon.ag (mon.0) 2621039 : cluster 0 mds.? [v2:10.0.0.14:6852/3205853461,v1:10.0.0.14:6853/3205853461] up:replay
mon cluster 2024-07-22T22:55:37.163556+0000 mon.ag (mon.0) 2621040 : cluster 0 mds.? [v2:10.0.0.12:6852/443370695,v1:10.0.0.12:6853/443370695] up:replay
mon cluster 2024-07-22T22:55:37.163610+0000 mon.ag (mon.0) 2621041 : cluster 0 fsmap defaultroot-rep3:2/2 {0=defaultroot-rep3-d=up:replay,1=defaultroot-rep3-c=up:replay} 2 up:standby
mon cluster 2024-07-22T22:55:37.351451+0000 mon.ag (mon.0) 2621042 : cluster 0 osd.21 failure report canceled by osd.75
mon cluster 2024-07-22T22:55:37.351565+0000 mon.ag (mon.0) 2621043 : cluster 0 osd.58 failure report canceled by osd.75
mon cluster 2024-07-22T22:55:37.365038+0000 osd.83 (osd.83) 1506 : cluster 3 8 slow requests (by type [ 'delayed' : 8 ] most affected pool [ 'defaultroot-rep3-metadata' : 8 ])
mon cluster 2024-07-22T22:55:37.511479+0000 osd.71 (osd.71) 1991 : cluster 3 1 slow requests (by type [ 'delayed' : 1 ] most affected pool [ 'defaultroot-rep3-metadata' : 1 ])
mon cluster 2024-07-22T22:55:37.750119+0000 mon.ag (mon.0) 2621044 : cluster 1 osd.69 failed (root=default,host=flora) (7 reporters from different host after 196.985080 >= grace 195.760520)
mon cluster 2024-07-22T22:55:37.762272+0000 mon.ag (mon.0) 2621045 : cluster 3 Health check update: 11 osds down (OSD_DOWN)
mon cluster 2024-07-22T22:55:37.797658+0000 mon.ag (mon.0) 2621046 : cluster 0 osdmap e408819: 94 total, 81 up, 92 in
mon cluster 2024-07-22T22:55:37.822423+0000 mon.ag (mon.0) 2621047 : cluster 0 osd.71 failure report canceled by osd.51
mon cluster 2024-07-22T22:55:37.836137+0000 mon.ag (mon.0) 2621048 : cluster 0 osd.71 failure report canceled by osd.41
mon debug 2024-07-22T22:55:38.825+0000 7f7614aa8700  1 mon.ai@1(peon).osd e408820 e408820: 94 total, 81 up, 92 in
mon cluster 2024-07-22T22:55:37.568300+0000 osd.62 (osd.62) 765 : cluster 3 1 slow requests (by type [ 'delayed' : 1 ] most affected pool [ 'nvme-ec32-rbd' : 1 ])
mon cluster 2024-07-22T22:55:37.643408+0000 osd.63 (osd.63) 1174 : cluster 3 1 slow requests (by type [ 'delayed' : 1 ] most affected pool [ 'defaultroot-rep3-metadata' : 1 ])
mon cluster 2024-07-22T22:55:37.973685+0000 osd.11 (osd.11) 1717 : cluster 3 1 slow requests (by type [ 'delayed' : 1 ] most affected pool [ 'mediaroot-rep3-new' : 1 ])
mon cluster 2024-07-22T22:55:38.189362+0000 mon.ag (mon.0) 2621049 : cluster 0 osd.71 failure report canceled by osd.11
mon cluster 2024-07-22T22:55:38.371517+0000 osd.83 (osd.83) 1507 : cluster 3 8 slow requests (by type [ 'delayed' : 8 ] most affected pool [ 'defaultroot-rep3-metadata' : 8 ])
mon cluster 2024-07-22T22:55:38.446097+0000 mon.ag (mon.0) 2621050 : cluster 0 osd.71 failure report canceled by osd.46
mon cluster 2024-07-22T22:55:38.525689+0000 osd.71 (osd.71) 1992 : cluster 3 1 slow requests (by type [ 'delayed' : 1 ] most affected pool [ 'defaultroot-rep3-metadata' : 1 ])
mon cluster 2024-07-22T22:55:38.624519+0000 mon.ag (mon.0) 2621051 : cluster 0 osd.71 failure report canceled by osd.26
mon cluster 2024-07-22T22:55:38.695707+0000 mon.ag (mon.0) 2621052 : cluster 0 osd.71 failure report canceled by osd.81
mon cluster 2024-07-22T22:55:38.828128+0000 mon.ag (mon.0) 2621053 : cluster 0 osdmap e408820: 94 total, 81 up, 92 in
mon cluster 2024-07-22T22:55:38.838528+0000 mon.ag (mon.0) 2621054 : cluster 0 osd.70 failure report canceled by osd.62
mon cluster 2024-07-22T22:55:38.841821+0000 mon.ag (mon.0) 2621055 : cluster 0 osd.90 failure report canceled by osd.64
mon cluster 2024-07-22T22:55:39.123142+0000 mon.ag (mon.0) 2621056 : cluster 0 osd.71 reported failed by osd.46
mon audit 2024-07-22T22:55:39.150410+0000 mon.aj (mon.2) 169592 : audit 0 from='admin socket' entity='admin socket' cmd='mon_status' args=[]: dispatch
mon audit 2024-07-22T22:55:39.150602+0000 mon.aj (mon.2) 169593 : audit 0 from='admin socket' entity='admin socket' cmd=mon_status args=[]: finished
```

**Reply by microyahoo** [reply]
Are you using the host network? Is the network between the nodes functioning normally? Has the network subnets of the cluster changed?
> To configure Ceph networks, you must add a network configuration to the [global] section of the configuration file. Our 5-minute Quick Start provides a trivial Ceph configuration file that assumes one public network with client and server on the same network and subnet. Ceph functions just fine with a public network only. However, Ceph allows you to establish much more specific criteria, including multiple IP network and subnet masks for your public network. You can also establish a separate cluster network to handle OSD heartbeat, object replication and recovery traffic. Don’t confuse the IP addresses you set in your configuration with the public-facing IP addresses network clients may use to access your service. Typical internal IP networks are often 192.168.0.0 or 10.0.0.0.

https://docs.ceph.com/en/quincy/rados/configuration/network-config-ref/

**Reply by BlaineEXE** [reply]
I agree with microyahoo that this sounds like network errors of some kind.

Monitors are accessible via a k8s service IP, so OSDs will always use that. That suggests that the CNI is working. The OSDs can't see each other, however, which suggests communication between hosts is down.

In addition to checking host-to-host connectivity, I would suggest using the toolbox to see if `ceph config dump` shows any config set for `public_network` and/or `cluster_network`. Then make sure, if they are set, that they match the network CIDRs that are available. 

They don't need to be set, but it might help to set `public_network` at a minimum. You can set either using `ceph config set` in the toolbox, or Rook can set them using `addressRanges`: https://rook.io/docs/rook/latest-release/CRDs/Cluster/ceph-cluster-crd/#network-configuration-settings

**Reply by psarossy** [reply]
Yes, using host networking, and have both `cluster_network` and `public_network` set, have not changed these for the past 3 years since this cluster exists.

Snippet from the CephCluster CRD which I added while trying to debug:
```
  network:
    addressRanges:
      cluster:
      - 10.40.0.0/24
      public:
      - 10.0.0.0/22
    ipFamily: IPv4
    provider: host
    selectors: null
```

I also have this in my rook-ceph/rook-config-override CM:
```
apiVersion: v1
data:
  config: |
    [global]
    public network =  10.0.0.0/22
    cluster network = 10.40.0.0/24
    public addr = ""
    cluster addr = ""
```

I have tried removing both, or have either or, makes no difference.

ceph config dump:
```
[root@rook-ceph-tools-56f44cf679-rjxft /]# ceph config dump
WHO                      MASK  LEVEL     OPTION                                          VALUE                                     RO
global                         advanced  cluster_network                                 10.40.0.0/24                              *
global                         basic     device_failure_prediction_mode                  local
global                         basic     log_to_file                                     false
global                         advanced  mon_allow_pool_delete                           true
global                         advanced  mon_allow_pool_size_one                         true
global                         advanced  mon_cluster_log_file
global                         advanced  mon_pg_warn_min_per_osd                         0
global                         advanced  mon_target_pg_per_osd                           100
global                         advanced  osd_pool_default_pg_autoscale_mode              on
global                         advanced  osd_scrub_auto_repair                           true
global                         advanced  public_network                                  10.0.0.0/22                               *
global                         advanced  rbd_default_features                            3
mon                            advanced  auth_allow_insecure_global_id_reclaim           false
mon                            advanced  mon_warn_on_insecure_global_id_reclaim_allowed  false
mgr                            advanced  mgr/balancer/active                             true
mgr                            advanced  mgr/balancer/mode                               upmap
mgr                            advanced  mgr/dashboard/PROMETHEUS_API_SSL_VERIFY         false                                     *
mgr                            advanced  mgr/dashboard/RGW_API_ACCESS_KEY                redacted                      *
mgr                            advanced  mgr/dashboard/RGW_API_SECRET_KEY                redacted  *
mgr                            advanced  mgr/dashboard/server_port                       8443                                      *
mgr                            advanced  mgr/devicehealth/enable_monitoring              true
mgr                            advanced  mgr/influx/hostname                             10.0.0.203                                *
mgr                            unknown   mgr/orchestrator_cli/orchestrator               rook                                      *
mgr                            unknown   mgr/pg_autoscaler/autoscale_profile             scale-up                                  *
mgr                            advanced  mgr/prometheus/rbd_stats_pools                                                            *
mgr                            advanced  mgr/telemetry/channel_perf                      true                                      *
mgr                            advanced  mgr/telemetry/contact                                                                     *
mgr                            advanced  mgr/telemetry/description                                                                 *
mgr                            advanced  mgr/telemetry/enabled                           true                                      *
mgr                            advanced  mgr/telemetry/last_opt_revision                 3                                         *
mgr                            basic     target_max_misplaced_ratio                      0.020000
osd                            advanced  osd_max_backfills                               32
osd                            basic     osd_memory_target                               2147483648
osd                            advanced  osd_recovery_max_active                         32
osd                            advanced  osd_recovery_max_single_start                   32
osd                            advanced  osd_recovery_sleep                              0.000000
osd                            advanced  osd_scrub_auto_repair                           true
osd                            advanced  osd_scrub_during_recovery                       true
osd.0                          basic     osd_mclock_max_capacity_iops_ssd                16141.377201
<--snip osds -->
osd.95                         basic     osd_mclock_max_capacity_iops_hdd                325.183685
mds                            advanced  mds_cache_trim_decay_rate                       0.900000
mds.defaultroot-rep3-a         basic     mds_join_fs                                     defaultroot-rep3
mds.defaultroot-rep3-b         basic     mds_join_fs                                     defaultroot-rep3
mds.defaultroot-rep3-c         basic     mds_join_fs                                     defaultroot-rep3
mds.defaultroot-rep3-d         basic     mds_join_fs                                     defaultroot-rep3
client.rgw.loki.store.a        advanced  rgw_enable_usage_log                            true
client.rgw.loki.store.a        advanced  rgw_log_nonexistent_bucket                      true
client.rgw.loki.store.a        advanced  rgw_log_object_name_utc                         true
client.rgw.loki.store.a        advanced  rgw_run_sync_thread                             true
client.rgw.loki.store.a        advanced  rgw_zone                                        loki-store                                *
client.rgw.loki.store.a        advanced  rgw_zonegroup                                   loki-store                                *
```

Ping and curl of the OSD ports between random OSD peers (they complain about each other in the logs):
```
[root@glaucus ceph]# ping 10.0.0.11
PING 10.0.0.11 (10.0.0.11) 56(84) bytes of data.
64 bytes from 10.0.0.11: icmp_seq=1 ttl=64 time=0.265 ms
64 bytes from 10.0.0.11: icmp_seq=2 ttl=64 time=0.225 ms
^C
--- 10.0.0.11 ping statistics ---
2 packets transmitted, 2 received, 0% packet loss, time 1020ms
rtt min/avg/max/mdev = 0.225/0.245/0.265/0.020 ms
[root@glaucus ceph]# ping 10.40.0.11
PING 10.40.0.11 (10.40.0.11) 56(84) bytes of data.
64 bytes from 10.40.0.11: icmp_seq=1 ttl=64 time=0.311 ms
64 bytes from 10.40.0.11: icmp_seq=2 ttl=64 time=0.238 ms
^C
--- 10.40.0.11 ping statistics ---
2 packets transmitted, 2 received, 0% packet loss, time 1011ms
rtt min/avg/max/mdev = 0.238/0.274/0.311/0.040 ms
[root@glaucus ceph]# curl 10.0.0.11:6802 2>1
ceph v2
[root@glaucus ceph]# curl 10.40.0.11:6802 2>1
ceph v2
```

TCPDump shows that the nodes are talking to each other on the correct ports, yet the OSDs say they are not getting the replies
```
psarossy@glaucus:~$ sudo tcpdump -i enp66s0d1 |grep 10.40.0.11.6802
tcpdump: verbose output suppressed, use -v or -vv for full protocol decode
listening on enp66s0d1, link-type EN10MB (Ethernet), capture size 262144 bytes
01:21:18.495367 IP 10.40.0.101.53104 > 10.40.0.11.6802: Flags [.], seq 712850260:712859208, ack 130461251, win 488, options [nop,nop,TS val 818841867 ecr 1342365987], length 8948
01:21:21.979449 IP 10.40.0.101.53104 > 10.40.0.11.6802: Flags [.], seq 0:8948, ack 1, win 488, options [nop,nop,TS val 818845351 ecr 1342365987], length 8948
01:21:28.639453 IP 10.40.0.101.53104 > 10.40.0.11.6802: Flags [.], seq 0:8948, ack 1, win 488, options [nop,nop,TS val 818852011 ecr 1342365987], length 8948
01:21:41.947448 IP 10.40.0.101.53104 > 10.40.0.11.6802: Flags [.], seq 0:8948, ack 1, win 488, options [nop,nop,TS val 818865319 ecr 1342365987], length 8948
01:22:07.241365 IP 10.40.0.101.49470 > 10.40.0.11.6802: Flags [S], seq 4055226838, win 62720, options [mss 8960,sackOK,TS val 818890613 ecr 0,nop,wscale 7], length 0
01:22:07.241567 IP 10.40.0.11.6802 > 10.40.0.101.49470: Flags [S.], seq 4058354634, ack 4055226839, win 62636, options [mss 8960,sackOK,TS val 1342417671 ecr 818890613,nop,wscale 7], length 0
01:22:07.241645 IP 10.40.0.101.49470 > 10.40.0.11.6802: Flags [.], ack 1, win 490, options [nop,nop,TS val 818890613 ecr 1342417671], length 0
01:22:07.242009 IP 10.40.0.101.49470 > 10.40.0.11.6802: Flags [P.], seq 1:27, ack 1, win 490, options [nop,nop,TS val 818890613 ecr 1342417671], length 26
01:22:07.242098 IP 10.40.0.11.6802 > 10.40.0.101.49470: Flags [P.], seq 1:27, ack 1, win 490, options [nop,nop,TS val 1342417672 ecr 818890613], length 26
01:22:07.242159 IP 10.40.0.101.49470 > 10.40.0.11.6802: Flags [.], ack 27, win 490, options [nop,nop,TS val 818890613 ecr 1342417672], length 0
01:22:07.242186 IP 10.40.0.11.6802 > 10.40.0.101.49470: Flags [.], ack 27, win 490, options [nop,nop,TS val 1342417672 ecr 818890613], length 0
01:22:07.242296 IP 10.40.0.101.49470 > 10.40.0.11.6802: Flags [P.], seq 27:99, ack 27, win 490, options [nop,nop,TS val 818890613 ecr 1342417672], length 72
01:22:07.242295 IP 10.40.0.11.6802 > 10.40.0.101.49470: Flags [P.], seq 27:99, ack 27, win 490, options [nop,nop,TS val 1342417672 ecr 818890613], length 72
01:22:07.242602 IP 10.40.0.101.49470 > 10.40.0.11.6802: Flags [P.], seq 99:329, ack 99, win 490, options [nop,nop,TS val 818890614 ecr 1342417672], length 230
01:22:07.242827 IP 10.40.0.11.6802 > 10.40.0.101.49470: Flags [.], ack 329, win 488, options [nop,nop,TS val 1342417672 ecr 818890613], length 0
01:22:07.242959 IP 10.40.0.11.6802 > 10.40.0.101.49470: Flags [P.], seq 99:171, ack 329, win 488, options [nop,nop,TS val 1342417672 ecr 818890613], length 72
01:22:07.243140 IP 10.40.0.101.49470 > 10.40.0.11.6802: Flags [P.], seq 329:543, ack 171, win 490, options [nop,nop,TS val 818890614 ecr 1342417672], length 214
01:22:07.243551 IP 10.40.0.11.6802 > 10.40.0.101.49470: Flags [P.], seq 171:259, ack 543, win 487, options [nop,nop,TS val 1342417673 ecr 818890614], length 88
01:22:07.243673 IP 10.40.0.11.6802 > 10.40.0.101.49470: Flags [P.], seq 259:327, ack 543, win 487, options [nop,nop,TS val 1342417673 ecr 818890614], length 68
01:22:07.243763 IP 10.40.0.101.49470 > 10.40.0.11.6802: Flags [.], ack 327, win 489, options [nop,nop,TS val 818890615 ecr 1342417673], length 0
01:22:07.243877 IP 10.40.0.101.49470 > 10.40.0.11.6802: Flags [P.], seq 543:611, ack 327, win 489, options [nop,nop,TS val 818890615 ecr 1342417673], length 68
01:22:07.243965 IP 10.40.0.101.49470 > 10.40.0.11.6802: Flags [P.], seq 611:656, ack 327, win 489, options [nop,nop,TS val 818890615 ecr 1342417673], length 45
01:22:07.244092 IP 10.40.0.11.6802 > 10.40.0.101.49470: Flags [.], ack 656, win 487, options [nop,nop,TS val 1342417674 ecr 818890615], length 0
01:22:07.244168 IP 10.40.0.11.6802 > 10.40.0.101.49470: Flags [P.], seq 327:368, ack 656, win 487, options [nop,nop,TS val 1342417674 ecr 818890615], length 41
01:22:07.244248 IP 10.40.0.101.49470 > 10.40.0.11.6802: Flags [P.], seq 656:850, ack 368, win 489, options [nop,nop,TS val 818890615 ecr 1342417674], length 194
01:22:07.244614 IP 10.40.0.11.6802 > 10.40.0.101.49470: Flags [P.], seq 368:527, ack 850, win 486, options [nop,nop,TS val 1342417674 ecr 818890615], length 159
01:22:07.287405 IP 10.40.0.101.49470 > 10.40.0.11.6802: Flags [.], ack 527, win 488, options [nop,nop,TS val 818890659 ecr 1342417674], length 0
01:22:08.315599 IP 10.40.0.101.53104 > 10.40.0.11.6802: Flags [.], seq 0:8948, ack 1, win 488, options [nop,nop,TS val 818891687 ecr 1342365987], length 8948
01:22:08.940811 IP 10.40.0.11.6802 > 10.40.0.101.49470: Flags [P.], seq 527:1333, ack 850, win 486, options [nop,nop,TS val 1342419370 ecr 818890659], length 806
01:22:08.940870 IP 10.40.0.101.49470 > 10.40.0.11.6802: Flags [.], ack 1333, win 482, options [nop,nop,TS val 818892312 ecr 1342419370], length 0
01:22:08.941633 IP 10.40.0.101.49470 > 10.40.0.11.6802: Flags [P.], seq 850:894, ack 1333, win 482, options [nop,nop,TS val 818892313 ecr 1342419370], length 44
01:22:08.941745 IP 10.40.0.101.49470 > 10.40.0.11.6802: Flags [P.], seq 894:938, ack 1333, win 482, options [nop,nop,TS val 818892313 ecr 1342419370], length 44
01:22:08.941906 IP 10.40.0.11.6802 > 10.40.0.101.49470: Flags [.], ack 938, win 486, options [nop,nop,TS val 1342419371 ecr 818892313], length 0
01:22:08.941957 IP 10.40.0.11.6802 > 10.40.0.101.49470: Flags [P.], seq 1333:1377, ack 938, win 486, options [nop,nop,TS val 1342419371 ecr 818892313], length 44
01:22:08.983390 IP 10.40.0.101.49470 > 10.40.0.11.6802: Flags [.], ack 1377, win 482, options [nop,nop,TS val 818892355 ecr 1342419371], length 0
^C13496 packets captured
13621 packets received by filter
0 packets dropped by kernel
```


10G public_network:
```
[root@glaucus ceph]# ip a show eno1
4: eno1: <BROADCAST,MULTICAST,UP,LOWER_UP> mtu 1500 qdisc mq state UP group default qlen 1000
    link/ether 24:6e:96:60:44:28 brd ff:ff:ff:ff:ff:ff
    altname enp1s0f0
    inet 10.0.0.101/22 brd 10.0.3.255 scope global eno1
       valid_lft forever preferred_lft forever
    inet6 fdc1:af1a:1aa4:e47:266e:96ff:fe60:4428/64 scope global dynamic mngtmpaddr noprefixroute
       valid_lft 1696sec preferred_lft 1696sec
    inet6 fe80::266e:96ff:fe60:4428/64 scope link
       valid_lft forever preferred_lft forever
```
40G cluster_network:
```
6: enp66s0d1: <BROADCAST,MULTICAST,UP,LOWER_UP> mtu 9000 qdisc mq state UP group default qlen 1000
    link/ether e4:1d:2d:16:01:72 brd ff:ff:ff:ff:ff:ff
    inet 10.40.0.101/24 brd 10.40.0.255 scope global enp66s0d1
       valid_lft forever preferred_lft forever
    inet6 fe80::e61d:2dff:fe16:172/64 scope link
       valid_lft forever preferred_lft forever
```
All switch port MTUs match card settings.

routing table:
```
[root@glaucus ceph]# ip r
default via 10.0.0.254 dev eno1 proto static
10.0.0.0/22 dev eno1 proto kernel scope link src 10.0.0.101
10.40.0.0/24 dev enp66s0d1 proto kernel scope link src 10.40.0.101
10.244.0.0/26 via 10.244.0.0 dev vxlan.calico onlink
10.244.1.0/26 via 10.244.1.0 dev vxlan.calico onlink
10.244.2.0/26 via 10.244.2.0 dev vxlan.calico onlink
10.244.3.0/26 via 10.244.3.0 dev vxlan.calico onlink
10.244.4.0/26 via 10.244.4.0 dev vxlan.calico onlink
10.244.5.0/26 via 10.244.5.0 dev vxlan.calico onlink
10.244.7.0/26 via 10.244.7.0 dev vxlan.calico onlink
blackhole 10.244.18.64/26 proto 80
10.244.18.66 dev calia17ed62f970 scope link
10.244.18.74 dev cali0fb1ae3c76f scope link
10.244.18.78 dev calid496bff4fec scope link
10.244.18.86 dev calid2aa7425f56 scope link
10.244.18.113 dev cali5b025b3cf6d scope link
10.244.18.120 dev calidf48d64265e scope link
10.244.85.192/26 via 10.244.85.192 dev vxlan.calico onlink
10.244.106.64/26 via 10.244.106.64 dev vxlan.calico onlink
10.244.112.0/26 via 10.244.5.0 dev vxlan.calico onlink
10.244.145.128/26 via 10.244.7.0 dev vxlan.calico onlink
10.244.177.128/26 via 10.244.177.128 dev vxlan.calico onlink
```

**Reply by psarossy** [reply]
I went ahead and made both the cluster and public network to be my 10G net.
The configs were updated by the operator.

The pod errors continue to be the same:
```
osd debug 2024-07-24T02:44:52.704+0000 7f3a3aaed700 -1 osd.66 438729 heartbeat_check: no reply from 10.0.0.10:6806 osd.50 ever on either front or back, first ping sent 2024-07-24T02:44:25.544217+0000 (oldest deadline 2024-07-24T02:44:45
```

TCPDump on 10.0.0.10 shows that they are talking (now with name resolution... artemis = 10.0.0.10, flora = 10.0.0.100):
```
$ sudo tcpdump -i eno1 src 10.0.0.100 and port 6806                                                                                                                                                                              [22:40:48]
tcpdump: verbose output suppressed, use -v or -vv for full protocol decode
listening on eno1, link-type EN10MB (Ethernet), capture size 262144 bytes
22:41:18.767340 IP flora.53610 > artemis.6806: Flags [P.], seq 1103539577:1103541700, ack 3430804732, win 3752, options [nop,nop,TS val 661447616 ecr 2296386478], length 2123
22:41:18.767664 IP flora.53610 > artemis.6806: Flags [.], ack 2124, win 3785, options [nop,nop,TS val 661447616 ecr 2296391179], length 0
22:41:18.861682 IP flora.53618 > artemis.6806: Flags [P.], seq 2876851309:2876853432, ack 3546951174, win 3864, options [nop,nop,TS val 661447710 ecr 2296388373], length 2123
22:41:18.861892 IP flora.53618 > artemis.6806: Flags [.], ack 2124, win 3897, options [nop,nop,TS val 661447710 ecr 2296391274], length 0
22:41:19.692516 IP flora.53604 > artemis.6806: Flags [P.], seq 1158357802:1158359925, ack 3978858436, win 4051, options [nop,nop,TS val 661448541 ecr 2296386802], length 2123
22:41:19.692754 IP flora.53604 > artemis.6806: Flags [.], ack 2124, win 4084, options [nop,nop,TS val 661448541 ecr 2296392104], length 0
22:41:19.852699 IP flora.58666 > artemis.6806: Flags [P.], seq 662985800:662987923, ack 2393221221, win 2458, options [nop,nop,TS val 661448701 ecr 2296386364], length 2123
22:41:19.852933 IP flora.58666 > artemis.6806: Flags [.], ack 2124, win 2491, options [nop,nop,TS val 661448701 ecr 2296392265], length 0
22:41:21.553743 IP flora.58666 > artemis.6806: Flags [P.], seq 2123:4246, ack 2124, win 2491, options [nop,nop,TS val 661450402 ecr 2296392265], length 2123
22:41:21.554022 IP flora.58666 > artemis.6806: Flags [.], ack 4247, win 2525, options [nop,nop,TS val 661450403 ecr 2296393966], length 0
22:41:21.762868 IP flora.53618 > artemis.6806: Flags [P.], seq 2123:4246, ack 2124, win 3897, options [nop,nop,TS val 661450611 ecr 2296391274], length 2123
22:41:21.763225 IP flora.53618 > artemis.6806: Flags [.], ack 4247, win 3930, options [nop,nop,TS val 661450612 ecr 2296394175], length 0
22:41:21.982996 IP flora.42502 > artemis.6806: Flags [P.], seq 3908366451:3908368574, ack 2847460744, win 2624, options [nop,nop,TS val 661450832 ecr 2296388494], length 2123
22:41:21.983230 IP flora.42502 > artemis.6806: Flags [.], ack 2124, win 2657, options [nop,nop,TS val 661450832 ecr 2296394395], length 0
22:41:23.797168 IP flora.53614 > artemis.6806: Flags [P.], seq 687366116:687368239, ack 1264573646, win 3984, options [nop,nop,TS val 661452646 ecr 2296390307], length 2123
22:41:23.797483 IP flora.53614 > artemis.6806: Flags [.], ack 2124, win 4017, options [nop,nop,TS val 661452646 ecr 2296396209], length 0
22:41:24.068408 IP flora.53610 > artemis.6806: Flags [P.], seq 2123:4246, ack 2124, win 3785, options [nop,nop,TS val 661452917 ecr 2296391179], length 2123
22:41:24.068772 IP flora.53610 > artemis.6806: Flags [.], ack 4247, win 3818, options [nop,nop,TS val 661452917 ecr 2296396480], length 0
22:41:24.884182 IP flora.42502 > artemis.6806: Flags [P.], seq 2123:4246, ack 2124, win 2657, options [nop,nop,TS val 661453733 ecr 2296394395], length 2123
22:41:24.884517 IP flora.42502 > artemis.6806: Flags [.], ack 4247, win 2691, options [nop,nop,TS val 661453733 ecr 2296397296], length 0
22:41:24.994404 IP flora.53604 > artemis.6806: Flags [P.], seq 2123:4246, ack 2124, win 4084, options [nop,nop,TS val 661453843 ecr 2296392104], length 2123
22:41:24.994643 IP flora.53604 > artemis.6806: Flags [.], ack 4247, win 4117, options [nop,nop,TS val 661453843 ecr 2296397406], length 0
22:41:25.169806 IP flora.53610 > artemis.6806: Flags [P.], seq 4246:6369, ack 4247, win 3818, options [nop,nop,TS val 661454018 ecr 2296396480], length 2123
22:41:25.170045 IP flora.53610 > artemis.6806: Flags [.], ack 6370, win 3852, options [nop,nop,TS val 661454019 ecr 2296397582], length 0
22:41:25.655103 IP flora.58666 > artemis.6806: Flags [P.], seq 4246:6369, ack 4247, win 2525, options [nop,nop,TS val 661454504 ecr 2296393966], length 2123
22:41:25.655551 IP flora.58666 > artemis.6806: Flags [.], ack 6370, win 2558, options [nop,nop,TS val 661454504 ecr 2296398067], length 0
22:41:25.864251 IP flora.53618 > artemis.6806: Flags [P.], seq 4246:6369, ack 4247, win 3930, options [nop,nop,TS val 661454713 ecr 2296394175], length 2123
22:41:25.864582 IP flora.53618 > artemis.6806: Flags [.], ack 6370, win 3963, options [nop,nop,TS val 661454713 ecr 2296398276], length 0
22:41:26.755565 IP flora.58666 > artemis.6806: Flags [P.], seq 6369:8492, ack 6370, win 2558, options [nop,nop,TS val 661455604 ecr 2296398067], length 2123
22:41:26.755932 IP flora.58666 > artemis.6806: Flags [.], ack 8493, win 2591, options [nop,nop,TS val 661455604 ecr 2296399167], length 0
22:41:27.297646 IP flora.53614 > artemis.6806: Flags [P.], seq 2123:4246, ack 2124, win 4017, options [nop,nop,TS val 661456146 ecr 2296396209], length 2123
22:41:27.297898 IP flora.53614 > artemis.6806: Flags [.], ack 4247, win 4051, options [nop,nop,TS val 661456146 ecr 2296399710], length 0
22:41:28.071953 IP flora.53610 > artemis.6806: Flags [P.], seq 6369:8492, ack 6370, win 3852, options [nop,nop,TS val 661456920 ecr 2296397582], length 2123
22:41:28.072166 IP flora.53610 > artemis.6806: Flags [.], ack 8493, win 3885, options [nop,nop,TS val 661456921 ecr 2296400484], length 0
22:41:28.999680 IP flora.53614 > artemis.6806: Flags [P.], seq 4246:6369, ack 4247, win 4051, options [nop,nop,TS val 661457848 ecr 2296399710], length 2123
22:41:28.999917 IP flora.53614 > artemis.6806: Flags [.], ack 6370, win 4084, options [nop,nop,TS val 661457848 ecr 2296401412], length 0
22:41:29.094615 IP flora.53604 > artemis.6806: Flags [P.], seq 4246:6369, ack 4247, win 4117, options [nop,nop,TS val 661457943 ecr 2296397406], length 2123
22:41:29.094867 IP flora.53604 > artemis.6806: Flags [.], ack 6370, win 4150, options [nop,nop,TS val 661457943 ecr 2296401507], length 0
22:41:29.595579 IP flora.53604 > artemis.6806: Flags [P.], seq 6369:8492, ack 6370, win 4150, options [nop,nop,TS val 661458444 ecr 2296401507], length 2123
22:41:29.595804 IP flora.53604 > artemis.6806: Flags [.], ack 8493, win 4183, options [nop,nop,TS val 661458444 ecr 2296402007], length 0
^C
40 packets captured
58 packets received by filter
0 packets dropped by kernel
```

**Reply by microyahoo** [reply]
You can check if the `firewall`, `SELinux`, and `NetworkManager` service are enabled. By the way, check if there is any useful information in `dmesg`.

**Reply by psarossy** [reply]
* dmesg unfortunately doesn't have anything useful (just local services complaining that the kubernetes loadbalanced services are unreachable)
* SELinux is not enabled
* NetworkManager is not installed
* firewall is stock iptables v1.8.4 (legacy), rules managed by Calico with nothing obvious: https://pastebin.com/raw/WApVjBjX

Have not changed anything in any of the above. Last login to the cluster machines was in February.

**Reply by psarossy** [reply]
After setting "set-ceph-debug-level" back to defaults and rebooting one of the controlplane nodes, suddenly I have a different set of errors:

```
Every 2.0s: ceph -s                                                                                                         rook-ceph-tools-56f44cf679-jhkqh: Thu Jul 25 02:55:10 2024

  cluster:
    id:     662ae7f1-f524-469e-b3d5-3d34ca40799e
    health: HEALTH_ERR
            1 filesystem is degraded
            1 filesystem has a failed mds daemon
            1 MDSs report slow metadata IOs
            1 MDSs report slow requests
            Module 'rook' has failed: HTTPSConnectionPool(host='10.96.0.1', port=443): Max retries exceeded with url: /api/v1/namespaces/rook-ceph/pods (Caused by NewConnectionError(
'<urllib3.connection.VerifiedHTTPSConnection object at 0x7faceddc5400>: Failed to establish a new connection: [Errno 111] Connection refused',))
            noout flag(s) set
            40 osds down
            1 host (14 osds) down
            Reduced data availability: 1084 pgs inactive, 823 pgs down, 4 pgs stale
            Degraded data redundancy: 28684334/436211756 objects degraded (6.576%), 344 pgs degraded, 365 pgs undersized
            531 pgs not deep-scrubbed in time
            375 pgs not scrubbed in time
            1678 daemons have recently crashed
            10 mgr modules have recently crashed

  services:
    mon: 3 daemons, quorum ag,ai,ak (age 4m)
    mgr: a(active, since 118m)
    mds: 1/2 daemons up (1 failed), 1 hot standby
    osd: 94 osds: 52 up (since 15m), 92 in (since 9d)
         flags noout
    rgw: 1 daemon active (1 hosts, 1 zones)

  data:
    volumes: 0/1 healthy, 1 failed
    pools:   15 pools, 1226 pgs
    objects: 57.17M objects, 193 TiB
    usage:   258 TiB used, 258 TiB / 516 TiB avail
    pgs:     88.418% pgs not active
             28684334/436211756 objects degraded (6.576%)
             823 down
             255 undersized+degraded+peered
             85  active+undersized+degraded
             38  active+clean
             18  active+undersized
             3   undersized+peered
             2   stale+undersized+degraded+peered
             1   stale+active+undersized+degraded
             1   stale+undersized+degraded+peered+wait

  io:
    client:   1.2 KiB/s rd, 1 op/s rd, 0 op/s wr
```

The down OSDs are now failing to activate with the following:
```
stream logs failed container "expand-bluefs" in pod "rook-ceph-osd-2-5fb64767df-zc9r6" is waiting to start: PodInitializing for rook-ceph/rook-ceph-osd-2-5fb64767df-zc9r6 (expand-bluefs)
stream logs failed container "chown-container-data-dir" in pod "rook-ceph-osd-2-5fb64767df-zc9r6" is waiting to start: PodInitializing for rook-ceph/rook-ceph-osd-2-5fb64767df-zc9r6 (chown-container-data-dir)
stream logs failed container "osd" in pod "rook-ceph-osd-2-5fb64767df-zc9r6" is waiting to start: PodInitializing for rook-ceph/rook-ceph-osd-2-5fb64767df-zc9r6 (osd)
activate + OSD_ID=2
activate + CEPH_FSID=662ae7f1-f524-469e-b3d5-3d34ca40799e
activate + OSD_UUID=ec9bc841-6606-4e9b-bf75-121189fd450e
activate + OSD_STORE_FLAG=--bluestore
activate + OSD_DATA_DIR=/var/lib/ceph/osd/ceph-2
activate + CV_MODE=lvm
activate + DEVICE=/dev/ceph-3ed1b0c1-f3ba-4327-ba47-63cffde4103a/osd-data-d3786a9c-a270-408e-9b0e-42188985c0d6
activate + cp --no-preserve=mode /etc/temp-ceph/ceph.conf /etc/ceph/ceph.conf
activate + python3 -c '
activate import configparser
activate
activate config = configparser.ConfigParser()
activate config.read('\''/etc/ceph/ceph.conf'\'')
activate
activate if not config.has_section('\''global'\''):
activate     config['\''global'\''] = {}
activate
activate if not config.has_option('\''global'\'','\''fsid'\''):
activate     config['\''global'\'']['\''fsid'\''] = '\''662ae7f1-f524-469e-b3d5-3d34ca40799e'\''
activate
activate with open('\''/etc/ceph/ceph.conf'\'', '\''w'\'') as configfile:
activate     config.write(configfile)
activate '
activate + ceph -n client.admin auth get-or-create osd.2 mon 'allow profile osd' mgr 'allow profile osd' osd 'allow *' -k /etc/ceph/admin-keyring-store/keyring
activate /home/jenkins-build/build/workspace/ceph-build/ARCH/x86_64/AVAILABLE_ARCH/x86_64/AVAILABLE_DIST/centos8/DIST/centos8/MACHINE_SIZE/gigantic/release/18.2.2/rpm/el8/BUILD/ceph-18.2.2/src/mon/MonMap.h: In function 'void MonMap::
add(const mon_info_t&)' thread 7f528c8b2700 time 2024-07-25T02:48:30.234004+0000
activate /home/jenkins-build/build/workspace/ceph-build/ARCH/x86_64/AVAILABLE_ARCH/x86_64/AVAILABLE_DIST/centos8/DIST/centos8/MACHINE_SIZE/gigantic/release/18.2.2/rpm/el8/BUILD/ceph-18.2.2/src/mon/MonMap.h: 221: FAILED ceph_assert(ad
dr_mons.count(a) == 0)
activate  ceph version 18.2.2 (531c0d11a1c5d39fbfe6aa8a521f023abf3bf3e2) reef (stable)
activate  1: (ceph::__ceph_assert_fail(char const*, char const*, int, char const*)+0x135) [0x7f5292c64e15]
activate  2: /usr/lib64/ceph/libceph-common.so.2(+0x2a9fdb) [0x7f5292c64fdb]
activate  3: (MonMap::add(mon_info_t const&)+0x8a) [0x7f529308765a]
activate  4: (MonMap::add(std::__cxx11::basic_string<char, std::char_traits<char>, std::allocator<char> > const&, entity_addrvec_t const&, unsigned short, unsigned short)+0x175) [0x7f5293087b25]
activate  5: (MonMap::init_with_addrs(std::vector<entity_addrvec_t, std::allocator<entity_addrvec_t> > const&, bool, std::basic_string_view<char, std::char_traits<char> >)+0x87) [0x7f5293080177]
activate  6: (MonMap::init_with_ips(std::__cxx11::basic_string<char, std::char_traits<char>, std::allocator<char> > const&, bool, std::basic_string_view<char, std::char_traits<char> >)+0x8b) [0x7f529308039b]
activate  7: (MonMap::build_initial(ceph::common::CephContext*, bool, std::ostream&)+0x61e) [0x7f5293083c8e]
activate  8: (MonClient::build_initial_monmap()+0x113) [0x7f52930622d3]
activate  9: (MonClient::get_monmap_and_config()+0x10c) [0x7f529306b85c]
activate  10: /lib64/librados.so.2(+0xcf623) [0x7f52936e6623]
activate  11: rados_connect()
activate  12: /usr/lib64/python3.6/site-packages/rados.cpython-36m-x86_64-linux-gnu.so(+0x6764b) [0x7f529386064b]
activate  13: /usr/lib64/python3.6/site-packages/rados.cpython-36m-x86_64-linux-gnu.so(+0x348bc) [0x7f529382d8bc]
activate  14: _PyObject_FastCallDict()
activate  15: /lib64/libpython3.6m.so.1.0(+0x10db00) [0x7f5296533b00]
activate  16: PyObject_Call()
activate  17: _PyEval_EvalFrameDefault()
activate  18: /lib64/libpython3.6m.so.1.0(+0x178dd8) [0x7f529659edd8]
activate  19: /lib64/libpython3.6m.so.1.0(+0x19c277) [0x7f52965c2277]
activate  20: _PyEval_EvalFrameDefault()
activate  21: /lib64/libpython3.6m.so.1.0(+0x178dd8) [0x7f529659edd8]
activate  22: /lib64/libpython3.6m.so.1.0(+0x19c277) [0x7f52965c2277]
activate  23: _PyEval_EvalFrameDefault()
activate  24: _PyFunction_FastCallDict()
activate  25: _PyObject_FastCallDict()
activate  26: /lib64/libpython3.6m.so.1.0(+0x10db00) [0x7f5296533b00]
activate  27: PyObject_Call()
activate  28: /lib64/libpython3.6m.so.1.0(+0x20d322) [0x7f5296633322]
activate  29: /lib64/libpython3.6m.so.1.0(+0x1b3524) [0x7f52965d9524]
activate  30: /lib64/libpthread.so.0(+0x81ca) [0x7f529620e1ca]
activate  31: clone()
activate /bin/bash: line 38:     9 Aborted                 (core dumped) ceph -n client.admin auth get-or-create osd."$OSD_ID" mon 'allow profile osd' mgr 'allow profile osd' osd 'allow *' -k /etc/ceph/admin-keyring-store/keyring
Stream closed EOF for rook-ceph/rook-ceph-osd-2-5fb64767df-zc9r6 (activate)
```
