### ISSUE TITLE
InvalidAccessKeyId with Traefik ingress controller

### ISSUE THREAD

**Issue by mellotron** [rook/rook#673]
Hello,

I have Traefik running as an ingress controller in my kubernetes cluster - this is also tied to Let's Encrypt so I have a valid cert on the domain.

I set up the object store per the documentation and then set up an ingress for RGW with:

```
---
apiVersion: extensions/v1beta1
kind: Ingress
metadata:
 name: rgw-ingress
 namespace: rook
spec:
 rules:
   - host: rgw.mycompany.com
     http:
       paths:
         - path: /
           backend:
             serviceName: rgw
             servicePort: 53390
```

I've also tried rgw-external for serviceName.

I use the values from and set:

```
export AWS_HOST=rgw.mycompany.com
export AWS_ENDPOINT=rgw.mycompany.com
export AWS_ACCESS_KEY_ID=long-string
export AWS_SECRET_ACCESS_KEY=even-longer-string
```

And then do:

```
$ s3cmd mb --host=rgw.mycompany.com s3://rookbucket
```

But this always returns:

```
ERROR: S3 error: 403 (InvalidAccessKeyId): The AWS Access Key Id you provided does not exist in our records.
```

Interestingly, I am able to use the object storage if I set the AWS_ENDPOINT to the NodePort the rgw-external service has however this doesn't come with TLS.

**Comment by mellotron** [comment]
Another interesting thing I noticed was that going to rgw.mycompany.com, I get:

```
<Error>
<Code>NoSuchBucket</Code>
<BucketName>rgw.mycompany.com</BucketName><RequestId>tx000000000000000000023-0059160fd6-137d72-default</RequestId>
<HostId>137d72-default-default</HostId>
</Error>
```

...while in the mean time, going to NodePort, I get:

```
<ListAllMyBucketsResult>
<Owner>
<ID>anonymous</ID>
<DisplayName/>
</Owner>
<Buckets/>
</ListAllMyBucketsResult>
```

**Comment by bzub** [comment]
Hi @mellotron,

I assume you're either masking the real domain in your Ingress with mycompany.com or you own that domain?  If so, I'd suggest looking at the Traefik pod's logs right after you attempt an S3 action on it.  I'm curious what the connection looks like when it reaches Traefik and how it gets routed.  Look for any lines that mention "rgw" to start with.

**Comment by travisn** [comment]
Try using the `--access_key` and `--secret_key` command line variables for s3cmd instead of relying on the env variables. I have seen before where `s3cmd` doesn't pick up the env vars

**Comment by mellotron** [comment]
@bzub The only thing I can see in the logs is:

'time="2017-05-14T09:29:24Z" level=debug msg="Round trip: http://10.244.5.17:53390, code: 404, duration: 6.171444ms tls:version: 303, tls:resume:false, tls:csuite:c02f, tls:server:rgw.mycompany.com"
time="2017-05-14T09:41:03Z" level=debug msg="Round trip: http://10.244.4.49:53390, code: 403, duration: 453.031µs tls:version: 303, tls:resume:false, tls:csuite:c02f, tls:server:rgw.mycompany.com"

(and yes - I am sed'ing out my domain name)

@travisn Interestingly, with that (and adding "--host-bucket=" which doing tcpdump against, if omitted s3cmd goes to AWS), I get: "ERROR: S3 error: 403 (SignatureDoesNotMatch)" as an error instead.

**Comment by mellotron** [comment]
I've done a tcpdump on one of the RGW hosts with:

```
$ tcpdump -n -i eth0 host traefik.ip -A
```

And got the following:

```
10:12:48.316564 IP 192.168.1.6.50622 > 10.244.4.49.53390: Flags [P.], seq 3312:3680, ack 3637, win 781, options [nop,nop,TS val 122284737 ecr 122283509], length 368
E...5]@.@.3$....
..1....@............i.....
.I...I..GET / HTTP/1.1
Host: rgw.mycompany.com
User-Agent: Go-http-client/1.1
Accept-Encoding: identity
Authorization: AWS ACCESSKEYISHERE:RANDOMCHANGINGSTRINGISHERE
X-Amz-Date: Sun, 14 May 2017 10:12:47 +0000
X-Forwarded-For: MYCLIENTSIPV6ADDRESS
X-Forwarded-Host: rgw.mycompany.com
X-Forwarded-Proto: https
X-Forwarded-Server: traefik


10:12:48.316839 IP 10.244.4.49.53390 > 192.168.1.6.50622: Flags [P.], seq 3637:3843, ack 3680, win 511, options [nop,nop,TS val 122284737 ecr 122284737], length 206
E...2_@.@.6.
..1............@..k...........
.I...I..HTTP/1.1 403 Forbidden
Content-Length: 198
x-amz-request-id: tx00000000000000000005d-0059182da0-137d72-default
Accept-Ranges: bytes
Content-Type: application/xml
Date: Sun, 14 May 2017 10:12:48 GMT


10:12:48.316863 IP 192.168.1.6.50622 > 10.244.4.49.53390: Flags [.], ack 3843, win 790, options [nop,nop,TS val 122284737 ecr 122284737], length 0
E..45^@.@.4.....
..1....@..k...P...........
.I...I..
10:12:48.316879 IP 10.244.4.49.53390 > 192.168.1.6.50622: Flags [P.], seq 3843:4041, ack 3680, win 511, options [nop,nop,TS val 122284737 ecr 122284737], length 198
E...2`@.@.6.
..1...........P@..k...........
.I...I..<?xml version="1.0" encoding="UTF-8"?><Error><Code>SignatureDoesNotMatch</Code><RequestId>tx00000000000000000005d-0059182da0-137d72-default</RequestId><HostId>137d72-default-default</HostId></Error>
10:12:48.316887 IP 192.168.1.6.50622 > 10.244.4.49.53390: Flags [.], ack 4041, win 798, options [nop,nop,TS val 122284737 ecr 122284737], length 0
E..45_@.@.4.....
..1....@..k...............
.I...I..
```

**Comment by fannyfan414** [comment]
how did you solve this problem? i use it with ingress and also get error 

> SignatureDoesNotMatchtx0000000000 00000000b7c-005d54 (truncated...)                                                                       SignatureDoesNotMatch (client):  - SignatureDoesNo tMatchtx000000000000000000b7c-005d547598-62b7-my-store62b7-my-st ore-my-store'
> --
